timecode,text
00:33:40,"três minutos e quarenta e três segundos dentro da piscina. minutos e quarenta e três segundos dentro da piscina. Pessoal olhando aqui é quem faltaria aí. imaginar três e quarenta e três a piscina? O falecido tenente Josemar, meu colega da Brigada Parabeniza"
00:34:00,"ficou um pouco mais, mas não valeu porque ele desmaiou. tirou o boné da piscina do cara Difícil abrir a boca, a língua dele tinha orado. Depois ele fez outro teste lá, tirou as tirou nove ou oito lá. Né? Mas ele desmaiou, né? Não valeu. Você tinha que ficar consciente. Está vendo uma fé aqui, é fé?"
00:34:20,"Três e quarenta e três. Não é pra qualquer um, né? Com todo respeito. Mas não tinha um bom preparo físico. Eu sei o que é falta de ar. Sou mergulhador também de de garrafa, de cilindro. Né? Estive em dois mil e quinze Quando ou melhor, em noventa e cinco quando caiu"
00:34:40,"Lamentável acidente na na Dutra na Serra das Araras no córrego do Vigário quando caiu ali um ônibus com da Cometa e quinze pessoas eh perderam suas vidas. E eu fui lá como voluntário pra mergulhar pra resgatar corpos, né?"
00:34:59,"Então sei o que é isso Tenho noção o que é você ficar ali desesperado por vez por falta de ar mesmo em treinamento sabendo que vão te buscar mas sei o que é isso né? Agora mãos nordestinos"
00:35:18,"Morreu no nordeste a turma do Gabo assim Rui Costa roubaram, desviaram cinquenta milhões de reais do dinheiro que nós mandamos pro estado. Eles fizeram um consórcio ou as compra vai ser coordenada pelo Carlos Garbas aqui."
00:35:35,"E a Bahia votar nesse candidato do PT que teve segunda pior educação do Brasil meu Deus do céu então eu estou do outro lado eu não voto na Bahia voto no Rio de Janeiro"
00:35:52,"Mas se eu voltar da Bahia votaria em ACM Neto e ponto final. Eu não quero nem saber se o ACM quer ou não quer um apoio. Mesmo que ele falasse o Bolsonaro você volta a trabalhar e não quer que você vote em mim. Tá? Você não quer, mas eu vou votar em você. Porque no PT eu não voto. E anular o voto eu também não anulo."
00:36:11,"Então você da Bahia se libertar desse momento. A hora de você quebrar as algemas fica livre do PT. Olhe bem meus irmãos não só estados mas municípios né?"
00:36:29,"Nós temos vinte e seis estados do Brasil, Distrito Federal. Temos quase cinco mil e setecentos municípios. Se está indo mal uma coisa no município, no estado. Ou está muito tempo com o problema. uma olhadinha no partido que governou estados e municípios"
00:36:46,"Você vai ter a certeza absoluta que em local onde governou a esquerda o PT esses estados e município estão piores que os outros estados. Será que é difícil ver isso? Sacrifício é te convencer disso?"
00:37:03,"Tem lugar no Brasil aqui que o PT ficou vinte anos. O PT foi criado em oitenta. pleno regime militar, né? Olha só O PT nasceu no regime. Ele está falando tanto em ditadura o PT nasceu aí dentro. Figueiredo do presidente. Regime militar."
00:37:22,"Depois de algum tempo começou a ganhar corpo, ganhar prefeituras, estado e tenha certeza de uma coisa, se você vai pra qualquer município do Brasil e você nunca foi lá, você quer saber se aquele município lá perdido, lugar distante"
00:37:41,"Se o município é bom ou não é bom? Tem quantos vereadores do PT nesse município? Se for zero o município é bom. Não tem demagogia, não tem mentira, tem seriedade. três, quatro, cinco"
00:37:59,"Realmente tem coisa errada naquele município. Tem mentira, tem descaso, tem ideologia de gênero. tem MST tem tudo o que não presta É simples você fazer uma comparação"
00:38:17,"Entre PT e os outros. Olha o Brasil meu Deus do céu. Acabei de mostrar aqui no começo. O onde apareceu a ideologia de gênero? O governo nula. PNDH três. É só dar o Google aí. PNDH três. É um negócio grande."
00:38:35,"Mas se você quiser conhecer o que que é o PT vai lá Cê quer conhecer? tanto aqui Falei ideologia de gênero. O PT acabei de ler aqui"
00:38:54,"Quer liberar as drogas, quer desencarcerar muita gente. Tu acha que o PT sobre audiência de custódia. Sou contra ou sou a favor? Alguém pode dizer, sou contra a favor? Que que é audiência de custódia? O cara é preso."
00:39:12,"tem até vinte e quatro horas pra ser ouvido. E ali o juiz decide se bota o cara na rua não. bota na rua e de vez em quando acontece cada absurdo com um montão de cocaína no homem e vai embora. Pergunte o PT é favorável ou não"
00:39:31,"essa tal de audiência de custódia. É favorável. Nós somos contra. Quando o PT fala em desarmamento está aqui na proposta deles tá? Encontro nacional de direitos humanos, né? Desarmar o país. O Lula teve no Complexo do Alemão."
00:39:51,"Ele foi conversar com o povo, honesto, trabalhador que noventa e nove ponto nove por cento do povo é honesto, trabalhador lá Não foi conversar com o povo. aquele propôs um desarmamento ali pros traficantes? Botou o boné lá no CTX, né?"
00:40:09,"Será que ele falou pessoal Entregar as arma aí e agora né? Pra dar exemplo vamos jogar mais em cima de um caminhão aí pra mostrar que o desarmamento é pra valer. O desarmamento é pra você cidadão de bem. Eu vou ao Brasil todo Você não precisa voar o Brasil todo."
00:40:29,"Sei que custa caro uma passagem aérea. Enquanto a gente vê locais isolados lá embaixo, uma fazenda, uma chácara. Imagina aquela pessoa não ter uma arma dentro de casa. Escuta o barulho. Está lá um animal lá"
00:40:47,"Berrando no quintal o que que está acontecendo? atacado porque está sendo estão roubando animal e você desarmado dentro de casa. Desarmar traficante eu não quero. Dá exemplo Lula. Você quer desamá-lo?"
00:41:05,"Comece amando aí essas comunidades que você visita. Repito, lá noventa e nove ponto nove por cento do cidadão de bem. Você não foi ver esse pessoal. Esse pessoal está preocupado com o voto deles. Aí está preocupado. Você quer legalizar as drogas. E você foi recebido"
00:41:25,"lá desacompanhado de policiais civis e militares. comunidades, pessoas como você Só sobra e tiver autorizado pelo tráfico. E você? Estava autorizado. botou o gorrinho lá do CTX"
00:41:44,"Hã? muito bem tratado pelos traficantes. Qualquer outra pessoa não entraria. um dia não sair. você não foi conversar com o cidadão de bem. Você foi ver o voto daquela massa que tem lá."
00:42:03,"Via acordo com o traficante. Tem dúvida que teve algum acordo com o traficante? Amanhã eu tiro esse assunto pode voltar aqui Por ocasião do debate, né?"
00:42:20,"Quer me atacar iniciando aquela história toda soldado Veneciano Elas me tiraram a tona dele. Vai querer partir pra baixaria. Mas o Lula"
00:42:38,"é recebido um tapete vermelho pelo tráfico aqui no Rio de Janeiro. Repito grande maioria dos trabalhadores, dos moradores do complexo são pessoas de bem. A única coisa que o Lula se interessa em vocês"
00:42:58,"É o seu voto. Lembra quanto era o teu auxílio o teu a tua Bolsa Família com o Lula? Tu lembra quanto é que era? E vê quanto é conosco agora. Olha a diferença. Por que eu posso pagar mais? Porque eu não rolo."
00:43:13,"Eu me cerco de pessoas decentes, honestas. De tudo quanto é tipo de gente. Está aqui um arlegão aqui. Valeu. Tranquilo? Bem. me acusa, né? Amigo do Hélio por conveniência, conheço ele há duzentos anos."
00:43:31,"Está certo? Que a chama de de irmão aí. tá certo? Até o Da minha historinha da daquela medalha de vacinador com palma né? Eu queria lembrar um fato aqui que vai vai chegar ao conhecimento aí pra encerrar aqui. Dois mil e quinze se eu não me engano."
00:43:50,"Dois mil e quatorze, dois mil e quinze. Eu estava na Barra da Tijuca Hotel Sheraton, posto quatro e vi duas meninas japonesinhas que estava na eminência de se afogar. né? Ela estava entrando numa eu percebi que tem algo errado"
00:44:10,"Eu tenho sexto sentido pra isso. Tenho mais de dez salvamentos da minha vida. cutuquei o sargento Mozart que estava comigo, né? Agora é a segunda televisão do Exército Brasileiro. Mostra se prepara que vai ter problema. O que foi? Olha lá. preparado? Eu pego aquela você pega aquela outra. Bem."
00:44:29,"No B oito afundaram fui lá trouxe as duas japonesinhas né? Eram eh Jamonezinha não japonesinha legítima. Eu estava eh abrasileirada aí. Como é que chama aí? De seis né? E deviam ter uns quatorze anos de menino. Acho que dois mil e quinze, dois mil e dezesseis."
00:44:47,"Deve ter hoje vinte e um, vinte e dois anos. E nós tiramos eu e o Moro, essas duas japonesinhas que estavam morrendo afogado. Tiramos as duas câmeras sentadas, choravam copiosamente, chegavam parente. Tudo bem? cumprimentá-lo, fomos embora e esquecemos."
00:45:03,"Eu espero um dia encontrar essas duas japonesinhas aí que com toda certeza uma passagem que marcado quase virou uma tragédia umas férias no Rio de Janeiro eu estou agora lá no posto quatro da Barra Tijuca em frente ao Hotel Sheron."
00:45:21,"tá? Eu espero encontrar com essas duas meninas aí eh vocês vão ter que me procurar obviamente né? Que eu não sei como encontrá-las. Mas se é isso que vai apontando por aí vai aparecer isso aí. Bem a todos vocês amanhã"
00:45:41,"Pô está bom. INSTAGRAM, YouTube, TikTok. Duzentos e sessenta mil, tá muito bom. Pessoal, Posso pagar a missão? Ou é pedido? missão até domingo."
00:45:58,"Arranjar mais um voto por dia. aqui vocês aqui ó quem está me ouvindo mais um dia um milhão de votos só vocês estão me assistindo aqui é possível, é vocês terem argumentos, você tem jeito pra conversar com as pessoas."
00:46:15,"Tem como levar agora o idoso pra votar. O voto vai ser rápido, é só um voto. E você que está na fila, nós sabemos que o idoso tem direito de passar na frente, mas estimule passar na frente. idoso passar na frente. É o pessoal que vai votar na gente."
00:46:32,"Tem lugar que eu não recomendo ir com a roupa amarela porque tem tido informações né? Que as pessoas ficam eh criando problema se as pessoas voltarem. Então quem está num local onde qualquer problema vai com uma roupa normal."
00:46:51,"Aquilo mais tranquilo, né? Interior tem capitais dele também, pelo Brasil tem lugar mais tranquilo a camisa amarela aí. Então até domingo vamos arranjar mais um voto por dia. Pode ter certeza. Nós já acreditamos que a virada já aconteceu."
00:47:10,"Minas Gerais temos informações aqui porque quase todos os prefeitos estão trabalhando conosco um trabalho excepcional do governador Zema que entrou em nossa campanha muito obrigado Minas Gerais é tradição no Brasil só ganha eleição quem vence em Minas Gerais em São Paulo também"
00:47:28,"Temos o Tarcísio aqui jovem né? Escutando a polícia deve-se se eleger governador de São Paulo no Rio Grande do Sul, meus amigos aí da gauchada aí, as gaúchas também, Onyx Lorenzoni tá?"
00:47:46,"Eh desde o primeiro momento dois anos das eleições de dois mil e dezoito teve comigo, parlamentar pela minha campanha peço a você em especial quem está indeciso vote no Onyx no Rio Grande do Sul em Santa Catarina temos aí o Jorginho Melo No"
00:48:04,"Espírito Santo tá? Lá no estado do Amazonas o nosso Wilson que vem pela reeleição Bom demais por aí? Tem mais algum estado aí? Eu não quero que eu vou me criticar porque eu esqueci ocê. Hã?"
00:48:23,"Não, vamos ficar neutro em algum lugar aí, tá? Boa sorte aí pro eh pro pessoal cada um decida o seu voto aí nesses estados aí. Então Pra terminar aqui"
00:48:40,"Eólica no nordeste. Está feito aqui o acordo também. Eh a capacidade de instalação de Alto Nordeste é equivalente a cinquenta Itaipus. Dizer quem tem eólica em solo né? Aquele cara que alugou o terreno dele pra não vai sair daí vai continuar ele."
00:48:58,"Vai até se expandir mais ainda fica falando não ele vai tirar essa eólica da tua da tua propriedade e levar pro mar, tu vai perder teu salário, tua tua renda. Mentira. Mentira se o PT não mentir. Não é PT."
00:49:14,"Então com toda a certeza nós temos um mar de verdade e oportunidades teóricas e dizer mais que os royalties os recursos que se paga que as eólicas vão pagar para o auxílio Brasil. pra reduzir"
00:49:32,"A conta de energia elétrica social tudo certo do céu do nosso governo certo. Logicamente a gente pede a Deus mas pede a vocês aqui também. Vamos trabalhar pessoal."
00:49:48,"Vamos votar, arranjar mais um voto. Você tem às vezes um um filho, um sobrinho, né? não vou botar. Chega nele e fala assim, quer saber da real? Se a economia aqui for pro espaço, como for em outros países, né? Venezuela, tá indo na Argentina, no Chile. Como é que você vai viver, moleque?"
00:50:07,"Pô e o moleque que tenho o mínimo de racionalidade vamos assim dizer tá? Vamos ouvir o mais velhos. e você vai votar mesmo que seja em alguém vá votar a bíblia diz não seja"
00:50:25,"Seja quente ou seja frio. Não seja morno. Não fique em cima do muro. fique sem decidir, decida, vote e tenha orgulho de dizer em quem você votou. Eu votei no Fulano de tal. Vamos lá pessoal."
00:50:44,"muito obrigado a todos vocês Vamos acreditar, vamos em frente. Estou com a cara de cansado aqui que estou ralando pra caramba por aí. Peço que você faça o mesmo, reverta a voz. Vamos ganhar essa eleições. Acreditem, estamos juntos"
00:51:03,"Brasil acima de tudo, Deus acima de todos. Boa noite a todos."