timecode,text
00:00:00,"Especial. Você sabe que aposentadoria especial da aposentadoria. Bom, pela certeza pra baixo, na página vinte e cinco também. Fim da estabilidade emprego de funcionários públicos. Olha que eles acusa a gente o tempo todo, não é verdade?"
00:00:18,"São eles, são eles. Fim da estabilidade de emprego de funcionários públicos. Página trinta e dois. Fim da desoneração da cesta básica. Básica. Página trinta e cinco. Nós há muito tempo zeramos os impostos federais"
00:00:36,"dos produtos da cesta básica. O que que a turma do Alckmin e do PT querem fazer? Voltar cobrar imposto dos produtos da cesta básica. Uma coisa muito importante aqui. Eles querem reduzir em cinquenta por cento na dedução com saúde no imposto de renda."
00:00:56,"então tem o valor que você pode deduzir todo ano eles querem então no tocante a saúde cortar em cinquenta por cento. Ou seja você vai pagar mais imposto de renda com a turma do Alckmin e do Lula. Repito com a gente aqui"
00:01:15,"Não tem mentira não. O problema é a verdade. nos acusam o que está de fazer o que está no problema deles. Alterar regras isso aqui é um crime. Alterar regras para aposentadoria com moléstia grave."
00:01:31,"A turma do Alckmin e do PT não tem pena nem quem tem doença grave. É uma coisa lamentável. vai taxar as verbas rescisórias. Aquele quando você termina o contrato de trabalho, né?"
00:01:49,"E você recebe alguma coisa ali. Aquilo que não tem qualquer taxação será taxado. Pela turma do Alckmin e do Lula. Aqui eu já falei lá em cima, né? Aumentar a tributação do simples. Eu acho que já falei isso aqui."
00:02:05,"Outra coisa fim da desoneração da folha. Final do ano passado grupo de empresários esteve conosco lá pra negociar essa essa questão aqui. Ou seja, o imposto que se paga, né? O empresário paga."
00:02:22,"Eh ele pode optar vinte por cento folha ou de um a quatro por cento do faturamento bruto da empresa. É melhor pro empresário sim. Se ele paga menos imposto, ele pode pagar um salário maior."
00:02:39,"Ou ainda produzir mais barato algo que você vai comprar no final da linha. Aquela historinha de ah vamos taxar o empresário? No final das contas alguém tem que pagar essa conta. Então hoje em dia tem dezessete setores não pagam, tá? Eh imposto sobre"
00:02:57,"a Folha não paga vinte por cento sobre a folha. Pago de um a quatro por cento sobre o faturamento do emprego. E isso é bom para a empresa e é bom pra você. E eles querem então botar um ponto final na desoneração da folha. O cálculo aqui é superficial não é preciso. Eles arrecadariam mais"
00:03:17,"Duzentos bilhões de reais do empresariado brasileiro. contribuinte. Nós não só manter essa desoneração da folha tem como já aceitei com a equipe econômica e nós vamos entrar"
00:03:35,"Nesse nesse grupo de Serviços, né? Eh que podem ter a folha desonerada, nós vamos também botar o serviço de saúde ajudar aqui a pagar o piso dos enfermeiros, né? E deixar bem claro o Congresso aprovou o piso dos enfermeiros"
00:03:53,"eu sancionei e o ministro do supremo feito pelo PT que é o Barroso resolveu suspender esse essa concessão do piso de enfermagem. Estamos aqui buscando uma maneira de ajudar no caso aqui é a iniciativa privada de poder entrar por opção"
00:04:13,"Entre pagar vinte por cento do valor da folha ativo de imposto ou de um a quatro por cento sobre o faturamento bruto. Então está aqui o programa do Alckmin, pessoal. Do Alckmin barra PT. Vira o pacote de maldades."
00:04:31,"Então olha só, ele nos acusam de fazer o que estão programando fazer. Lula não tem programa plano de governo. Fica quieto. Assim como não tem nenhum nome de possível ministro pra ele. Porque nós já sabemos né?"
00:04:48,"um montão de gente ali está condenado em segunda e terceira instância trinta anos de cadeia outros com uma série de acusações são pessoas que lá atrás deixaram o governo do PT para irem pra cadeia. áudio cortado, recortado não, a gente quer que eu coloque essa daqui"
00:05:07,"Outra coisa, tá? Olha só, tem um videozinho correndo aí, se você olhar, precisa ter muita atenção não, você vê que é uma armação que eu vou reduzir o salário mínimo. Primeiro deixar bem claro. Ninguém pode reduzir o salário mínimo."
00:05:27,"teria que mandar um projeto pro congresso ninguém aprovaria um negócio desse. Então já é uma mentira logo de saída. Mas o PT nos acusa. E faz uma montagem de um vídeo. Né? Se você prestar atenção tem tem os cortes. Mas dá a entender que eu vou diminuir o valor do salário mínimo. Esse vídeo aqui"
00:05:47,"que eles fazem a montagem foi lá atrás em dois mil e vinte quando Por ocasião da pandemia estava decidindo, né? Onde arranjar recurso pra pandemia. Então vem uma proposta da câmara verbal presidente da câmara daquela época que era o deputado federal aí do Rio de Janeiro"
00:06:06,"ele queria tocar dar um corte de vinte e cinco por cento no salário, nas aposentadorias, de todos os servidores públicos. Deixar bem claro. Proposta lá do presidente da câmara, né? O seu Maia queria reduzir isso aqui. Vinte e cinco por cento. Nós somos contra."
00:06:26,"Fizemos uma contra proposta. Congelar por um ano e meio o salário do servidor. É assim que foi feito. muito menos ruim o congelamento do que o código de vinte e cinco por cento. Se tivesse feito o corte lá atrás de vinte e cinco por cento mesmo o reajuste de alguns prefeitos e governadores deram o ano passado e nesse ano né?"
00:06:45,"Não teria repouso os vinte e cinco por cento. Isso é uma verdade. O que que o essa turma da esquerda faz? Pega esse vídeo, faz uma montagem que eu quero reduzir, né? O governo mentirosamente, né? Quer reduzir o salário"
00:07:03,"Dos servidores em vinte e cinco por cento bem como aposentadorias, pensões e etcétera. a esquerda brasileira. PT também, né? PT, o zelo e desejo de fazer isso daí."
00:07:16,"Está acabando? até aqui uma coisa tem um copo d'água é só outra coisa, mostrar né? Pra vocês o que é o PT. É só dar o Google aí. Resoluções do Encontro Nacional de Direito Humano do PT."
00:07:35,"Pô! Você dá um pulo aí eu vou repetir a leitura aqui soluções do encontro nacional selva resoluções do Encontro Nacional de Direitos Humanos do PT."
00:07:54,"É um documento de doze dezembro de vinte e um. É fresquinho o documento dele. Então você vai ver que o documento Eu tenho aqui umas quarenta páginas e peguei aqui um, dois, quatro ou cinco itens. Simples."
00:08:12,"Tá? Você viu que está aqui o que o PT espera né? O que você pode esperar do PT? coisa aqui instituir uma política de reparação e punição o PT especialista nisso assume negócio a esquerda quer punir alguém."
00:08:31,"é pra mostrar que eles estão certos ou do lado sempre estava errado. Então eu vou instituir a a chamada Memória Verdade e Justiça. Processar e punir o responsáveis pelo genocídio do Brasil. Quem são os responsáveis pelo genocídio do Brasil. O PT vai achar alguém, né? Quem sabe seja eu, né? E"
00:08:50,"querer punir né? E também criar o tribunal de Manaus para julgar Bolsonaro e seus cumplices Manaus. Deixar bem claro depois estamos oxigênio. Né? Foi a uma nova cepa que de repente"
00:09:09,"Explodiu lá em Manaus muita gente hospitalizada Muita gente começou a morrer também e precisavam de oxigênio. O que que o Pazuello fez? Que foi o deputado federal mais votado aqui no estado do Rio de Janeiro. Então o povo"
00:09:26,"aqui do Rio reconhece o trabalho dele. Se ele fosse candidato em Manaus, seria com toda a certeza o deputado federal mais votado também. Que que o Pazeiro fez? oxigênio? Vocês sabem pra levar álcool aqui do do sudeste por exemplo? Oxigênio para a Amazônia tem que ser transporte aéreo."
00:09:45,"Nenhuma aviação do mundo, nem a militar transporta oxigênio líquido pelo risco iminente de explosão. Então se você botar oxigênio líquido no avião, né? E ele decora. Decoro aumenta a pressão interna"
00:10:05,"Pode haver vazamento. Havendo vazamento de explosão iminente O que que o pessoal da força aérea fez? o avião em menos de vinte e quatro horas com ladrão, né? Pra"
00:10:22,"vá possível vazamento de de oxigênio líquido pra fora da aeronave e decolar essa mesa mesmo sabendo que poderia ter a sua aeronave, o seu cacete trezentos e noventa, o seu Hércules explodido em pelo voo, aviação do mundo"
00:10:41,"Faz isso. A do Brasil fez por vidas. Mas dever ao PT criar aqui o tribunal de Manaus para julgar Bolsonaro em seus cúmplices. Esse é o PT. mais o que que eles querem pra pessoal da segurança pública?"
00:11:00,"Não é a segurança pública. É você que é beneficiado da segurança pública. Cê sabe que o PT tem uma né? De acabar com a polícia militar do Brasil. só falam maldade da polícia militar nós sabemos da essencialidade da polícia militar. Mas vamos lá"
00:11:20,"Que que o PT quer? sete aqui dessa resoluções do Encontro Nacional de Direitos Humanos. Deixar bem claro aqui. Reorganizar e desmilitarizar a Polícia Militar. Bem, não precisa entrar em detalhe o que seja isso, né? Outro item aqui."
00:11:38,"É do PT pessoal. Quando a gente fala em drogas, né? Cessar a guerra às drogas. o PT quer o quê? Regular e descriminalizar drogas está no documento do PT aqui. Você quer que"
00:11:55,"A droga seja legalizada no Brasil se possa comprar droga em qualquer lugar por aí O que que vai acontecer com as nossas crianças? Vão vender dentro da sala de aula. Imagina a desgraça que vai transformar o país com drogas dentro da escola. É o que o PT quer."
00:12:13,"Eu preciso dizer mais alguma coisa? Estou mostrando, não estou falando. Vamos lá daqui. rever o encarceramento em massa"
00:12:29,"E começar a desencarcerar milhares de presos provisórios. Então pro PT preso provisório tem que estar na rua. o que eu quero é a nossa uma das propostas nossa já que temos um parlamento agora muito mais de centro-direita"
00:12:45,"Nós acabarmos com a instituição da audiência de custódia. Ali libera todo mundo. Até cara que está com trinta quilo de de cocaína nas costa é liberado. Audiência de custódia. E que o PT quer botar todo mundo na rua. último item aqui"
00:13:04,"desarmar o país Nós já vimos esse filme no começo do governo do Lula sobre aquele referendo que a população decidiu que o Brasil, né? Deveria comercializar armas e munições e não impedir o comércio"
00:13:24,"então o Brasil decidiu que se poderia comercializar armas e munições no Brasil. O que que o PT fez? o referendo, fez o contrário. e começar uma política de desarmamento no Brasil. Vocês lembram, né? Pessoas humildes entregando armas. tá?"
00:13:43,"Deixando a sua casa desprotegida achando que eu quero a mãe daquela maneira e diminuir a violência no Brasil. Tá? Não diminuiu a violência no Brasil. Lá em dois mil e quatro. Muito pelo contrário aumentou muito."
00:13:55,"Começou a diminuir sim no meu governo. Quando assumimos em dois mil e dezenove. Entre outras coisas tem a participação de muitos do estado, mas teve também a nossa política de armas. Arma não é jogar pra cima e pegar quem quer. Com critérios quem quiser comprar e compra a sua água com critérios"
00:14:15,"Quem puder ter o porte de arma ou terá assustadoramente ou violentamente de violência Brasil. Estamos lá pro encerramento, pessoal? hoje é quinta-feira"
00:14:34,"Amanhã é sexta né? Me preparo pro debate na Globo temos um evento acho que em Minas Gerais o pessoal está batendo o martelo aqui eh no domingo mas chegar eu, time do Flamengo, lá do"
00:14:52,"Flamengo e Atlético Paranaense, né? Eu espero eh se Deus quiser receber aqui do aeroporto, se tiver oportunidade, obviamente, o time do Flamengo que virá lá de de quinto, que vai disputar aí o final da da Libertadores, um Atlético Paranaense."
00:15:11,"Então pessoal até domingo As pesquisas dizem, eu não acredito, nas pesquisas dizem que está empatado. Se lá atrás dizia que o outro lado tinha catorze por cento na frente e ficou cinco. Se está empatado agora porque estamos na frente. Mas mais do que"
00:15:30,"Nós aí Na vitória. Eu preciso de cada um de vocês até domingo vire por dia mais um voto apenas. E esse voto muitas vezes é dentro de casa. Acabei de elencar aqui uma série de de fatos, né"
00:15:49,"De coisas reais sobre trabalho, né? Sobre a nossa vida eh cotidiana que o PT prepara pra você. É um partido onde a mentira faz parte estado no DNA deles."
00:16:05,"e quando eu te quando mostramos alguma coisa nas televisões eh bloqueados vamos assim ser era um vídeo do próprio PT tá? O Lula dizia no passado tá? fez uma campanha mentindo e quando assumiu em dois mil e três"
00:16:24,"Teve que fazer completamente diferente. Você acredita que o PT agora está falando a verdade? eles querem fazer de mal tão botando na minha conta Ah! Salário mínimo! Nós vamos reajustar o mínimo acima da inflação! registrar os aposentados acima da inflação."
00:16:43,"Vamos registrar os servidores públicos acima da inflação. manter o auxílio no Brasil em seiscentos reais. Se nós arrumamos a economia e o Paulo Guedes arrumamos a economia."
00:17:02,"Que pegamos destroçada lá atrás Vencemos a pandemia, setecentos bilhões em dois mil e vinte com a pandemia. Aí incluindo o auxílio emergencial. Sessenta e oito bilhões de pessoas receberam auxílio emergencial."
00:17:20,"não tiveram notícia de uma só invasão de supermercado. Não tivemos problemas durante a pandemia. exato da política errada que não foi a minha, em casa a economia e te vê depois. arrumamos a economia. o Brasil quebrado"
00:17:40,"Arrumamos. Se está arrumado vamos agora aproveitar recuperar aquilo que perdemos no passado, dando reajuste real pra vocês. pergunto pra vocês vocês estão satisfeitos com o preço da gasolina hoje em dia?"
00:17:59,"Não foi na caretada não como fizeram no passado interferiu na Petrobras nós reduzimos o preço dos combustíveis impostos Reduzimos impostos estaduais, ICMS cobrava-se em média trinta por cento pra dezessete por cento."
00:18:17,"Zeramos os impostos federais. O imposto que eu cobrava o governo federal nós zeramos e está mantido o ano que vem tudo isso aí. Fizemos a nossa parte. Deixo bem claro. essa proposta de diminuir o preço da gasolina foi votado no Senado"
00:18:35,"Todo senador do PT votaram contra Quando nós criamos o auxílio Brasil na câmara o ano passado acabando com o Bolsa Família aquela aquela miséria que pagavam pra pro pessoal mais pobre do Brasil"
00:18:52,"Toda bancada do PT na câmara votou contra Brasil. o Bolsa Família começava com quarenta reais. pagava cento e noventa reais por mês pra treze milhões de famílias."
00:19:09,"Estamos pagando agora pra vinte e um milhões de famílias seiscentos reais de auxílio Brasil. Três vezes mais. depender do PT está no Bolsa Família ainda aí. é um inclusive no último penúltimo debate, último debate teve um comigo praticamente né"
00:19:29,"O Lula falou que a economia no governo no governo dele está muito boa. retruquei. Você estava tão boa porque você pagou tão pouco para os pobres? Eles não tem qualquer sentimento com o pobre. Pobre é massa de manobra pra eles. Para o PT pobre é número. Para o PT"
00:19:48,"pobre É aquilo que você você sabe pô. O que eles pensam de você. Nós agimos de maneira diferente. Quando se fala em picanha, faça uma comparação. Ano a ano o valor do Bolsa Família quantos quilos de picanha comprava?"
00:20:07,"Eu vou calcular pra cima. Comprar você em média quatro quilos de picanha. Com o auxílio do Brasil você compra dez quilos de picanha. Nós temos o auxílio gás. Mas mesmo assim um auxílio do Brasil dá pra comprar cinco botijões de gás. De uma família pequena"
00:20:27,"gasta a cada dois meses ô bojão e uma família pequena ganha em dois meses mil e duzentos reais com dez por cento disso ele compra o gás dele e tem também o auxílio gás Qual o governo fez mais pelos mais pobres? falando em números"
00:20:46,"E tem gente que não fizemos isso pensando em política, fizeram pra ajudar os mais necessitados. Porque temos dinheiro. É um governo que não rouba. Como eu tenho dito, né? De vez em quando fala palavrão, mas aqui não tem ladrão. Diferente do PT."
00:21:06,"Diferente do descontenado Lula ficou dois anos na cadeia. delatores devolveram seis bilhões de reais. Meus amigos, ninguém vai devolver seis bilhões de reais e você não roubou. empresas"
00:21:22,"Em acordo de leniência, né? Devolveram quinze bilhões de reais. E olha uma coisa importante. Você tem um amigo na Caixa Econômica? Você tem um amigo na Petrobras Correios com ele."
00:21:41,"o aposentado Posso ler teu contracheque? desconta para o fundo de pensão da Petrobras, da Caixa Econômica ou dos Correios? Lógico que eles contam. Tem um desconto extra aí e fala, tem."
00:22:00,"você pega por exemplo quem ganha cinco mil reais de aposentadoria nos Correios No contracheque dele tem um desconto de quinhentos e dez reais extra desconto pro fundo de pensão que é o Postales está lá um valor e tem um extra de quinhentos e dez reais"
00:22:19,"você sabe o que que é isso? o desconto extra que começou em dois mil e quinze e vai até dois mil e trinta? Você sabe por que existe isso? Você consegue imaginar o que seria mais quinhentos reais da sua aposentadoria no seu salário? Ou você que que está desempregado aí? Mais de quinhentos mil reais é dinheiro pra caramba pô!"
00:22:39,"Meu tempo de tenente capitão é equivalente a isso se entrasse na conta da gente era muito bem-vindo de forma legal obviamente né? Agora por que que ele paga esses quinhentos reais a mais? Que começou a descontar em dois mil e quinze vai até dois mil e trinta. Por dezesseis anos"
00:22:59,"esse carteiro está descontando quinhentos e dez reais por mês. Por que isso? Porque o PT botou gente deles pra administrar os fundos de pensões das empresas que roubaram sabe quanto? Sabe quanto aproximadamente o pessoal roubou do"
00:23:18,"Quarenta e cinco bilhões de reais. Pra você ter uma noção quarenta e cinco bilhões dá pra você fazer três vezes a transposição do Rio São Francisco. roubado pela turma do PT Se o PT continua mais dois, três anos"
00:23:37,"e o roubar tanto que esses aposentados repito Caixa Econômica, dos Correios da Petrobras não iam ter pensão. O PT é um bando de cupins roubam tudo, destrói tudo"
00:23:56,"Você que está no nordeste em grande parte que tem aposentadoria rural. aposentadoria rural em grande parte no Nordeste. Você quer perder isso? Não, você não quer. Mas se o estado não arrecadar dinheiro economia rodar não"
00:24:16,"O pessoal não fizer negócio no Brasil não entra dinheiro no caixa do governo não vai ter como pagar vocês e o PT é isso eles roubam tanto que no final das contas ia pagar a conta são vocês."
00:24:33,"Repito aqui, apelo endividamento da Petrobras seiscentos bilhões bilhões de reais. O endividamento da Petrobras passou a equivaler o dobro do valor da empresa. Por que isso?"
00:24:53,"A plataforma superfaturada compra a refinaria dos Estados Unidos dá passadinha na que é o ferro velho interfere na canetada no preço dos combustíveis e tudo quanto é assalto então de dois mil e três a dois mil e dezesseis"
00:25:09,"Quando ficou o PT por quatorze anos no governo proporcionar um endividamento da Petrobras em novecentos bilhões de reais. Quem está pagando a conta? Vocês. Todos vocês. E o Lula disse que quando voltar quer fazer melhor."
00:25:27,"Eu acho que ele quer roubar agora um bi, um trilhão e oitocentos. Você está dando quem está votando? Ele está dando aval pra ele. É isso que vocês querem. Alguns anos de vocês querem para o Brasil? No BNDES Ou não vou falar uma palavra, já falar aqui, né?"
00:25:46,"foram quatrocentos bilhões Na Caixa Econômica quarenta e cinco bilhões era o fundo de pensão da Caixa uma coisa, a Caixa como um todo. Ou você acha que aqueles cinquenta milhões de reais encontrado no apartamento do Geddel Vieira Lima lá em Salvador"
00:26:05,"Caiu do céu que dinheiro? Desviado em algum lugar. Caixa Econômica Federal. vocês sabem qual a função do Geddel Vieira Lima hoje? coordenador da campanha do Lula ele não vai chegar mas se chegar"
00:26:25,"O Geddel ia pra onde com toda certeza? Pra presidia a Caixa Econômica Federal. O Lula não tem moral pra formar um ministério independente. Não tem moral. Você sabe o que ele não anuncia antes?"
00:26:42,"Alguns ministros dele que já prometeram ministérios pra mais de duas pessoas. Vai voltar tudo que era antes, nós queremos isso para o Brasil? Merece isso? além de uma questão mais grave de todas"
00:27:02,"Imaginou quem seria os dois indicados para o supremo? Lula? Ou certamente seria O advogado do PT lá o Zanini, né? O outro seria aquele que já foi flagrado de bermudas dentro do Supremo Tribunal Federal."
00:27:20,"e o PT hipotético com mais duas vagas no supremo não adianta o parlamento falar ah o parlamento está mais conservador, mais de direita não vai adiantar o desequilíbrio entre os poderes a não ser que o senado reestabeleça vai fazer com que"
00:27:40,"A Suprema Corte legise tudo que for votado e sancionado pelo governo mesmo proposta de emenda da Constituição promulgada pelo Congresso. Você pode ver há poucos dias me acusaram"
00:27:55,"De querer aumentar o número de vaga para o Supremo Tribunal Federal. Escândalo, né? gente eu não voto mais nele. Até que no debate eu mostrei. Quem queria aumentar o número de cadeiras no Supremo Tribunal Federal foi o PT e treze."
00:28:14,"Dilma Rousseff presidente. de emenda da constituição de quem? Luiz Erundina. Quarenta deputado do PT assinaram a PEC. todo o PT ou quase todo, né? Que eu não fiz as contas o tamanho da bancada do PT naquela época mas"
00:28:32,"praticamente toda a bancada do PT votou pra que a proposta emenda da constituição continuasse tramitando para aumentar o número de vaga no Supremo Tribunal Federal. e de acusa a mim. Ah o cara quer já vi isso na Venezuela é o Chaves"
00:28:51,"que é amigo do sou eu pessoal. Quem quis aumentar no caso essa proposta de mais quatro ministro do supremo foi a Luiza e entre outros quarenta deputados do PT. Se coloca no meu lugar"
00:29:11,"As pancadas que a gente leva há quatro anos Não seria mais fácil eu estar do outro lado? Mas eu devo lealdade a vocês. E agora eu quero fazer um pedido pra você. Não vou pagar menção não. Fazer um pedido."
00:29:29,"Até domingo trabalhe pra mim. voto. Às vezes dentro da própria família. Se não tiver, o vizinho pelos radicais que é difícil, né? O cara é petista aí não tem como."
00:29:47,"e vocês me perguntar me convença a votar no seu candidato. Você não tem argumento. Vem gente de lá pra cá. Daqui pra lá não vai. Eu queria que alguém me apertasse um argumento pra votar no PT. Não tem. Não tem. Então peço pra você agora"
00:30:07,"Trabalho pra mim até domingo dezessete horas. Acredito na vitória hoje em dia. Mas nós temos que garantir essa vitória. Não podemos sonhar em deixar essa turma voltar a ocupar Brasília."
00:30:25,"Essa caneta Bic na mão daqueles bandidos fazem miséria. Pro lado de cá qual corrupção teve no meu governo? Teve duas, três acusações que não chegou a lugar nenhum."
00:30:40,"Até lá no senado uma senadora né? Que foi candidata chegou a denúncia lá do Carlos Gabas que já foi ministro Dilma Rousseff andava de moto ou de de bicicleta com ela não sei."
00:30:58,"Que havia desviado cinquenta milhões de reais Nordeste, você novo destino. Quantos irmãos nossos morreram por falta de ar em hospitais em dois mil e vinte porque o seu Carlos Garbas juntamente com Rui Costa"
00:31:16,"Ex-governado da Bahia que integrava ali o consórcio do Nordeste roubaram, desviaram cinquenta milhões de reais e não compraram obviamente nenhum respirador sequer. roubam. o ar das pessoas."
00:31:33,"vem me acusa que eu está debochando Veja o vídeo! Esse é o PT. Falar em Bahia? bem claro aqui. Bahia vem segundo turno. Tem segundo turno da Bahia. Tá? Lá tem o"
00:31:53,"Um candidato que é do PT. Olha, o candidato do PT pessoal foi o foi o era secretário de educação presta atenção o secretário de educação do PT que teve a segunda pior educação no Brasil foi escolhido por Rui Costa"
00:32:11,"Pra ser candidato a governador Dá pra entender um negócio desse? A a segunda pior educação do Brasil disputar o governo do estado da Bahia meu Deus do céu Indicado pelo Rui Costa."
00:32:26,"Um dos caciques do consórcio do Nordeste junto com Carlos Gavas que sumiram com cinquenta milhões de reais e deixaram irmãos nordestinos morrendo por falta de ar. Eu sou mergulhador profissional. Fiz meu curso no GBS lá atrás. de busca e salvamento."
00:32:45,"pessoal do rio aqui, sargento Coronel Sargento Val que já faleceu eu fugiu aqui o nome do tenente Silvio alguma coisa faleceu sei o que é."
00:33:04,"no treinamento que vocês me deram por trinta e cinco dias o que é ter falta de ar. tá? Por exemplo, quando a prova de apneia doze capitães inteligentes. Eu fui o zero um. prova de apneia tinham dez provinha no final, né? Pra ganhar dez. Então a prova de apneia não era"
00:33:23,"Tanto tempo um ou dois apneia. Tirava dez quem fosse o melhor aluno. Que mais ficasse apneia. Tirava nove o segundo e depois tinha uma um ajuste ali pra não tirar nota menos dois no final, né? Mas eu ganhei a prova de apneia."
