timecode,text
00:00:00,"Começa agora o programa Bolsonaro presidente. A gente sabe que a pandemia e a guerra geraram crise no mundo todo. Mas aqui no Brasil a gente está superando. Porque o governo Bolsonaro incentiva a geração de emprego."
00:00:19,"Desde quando assumimos diminuímos vários impostos no Brasil. Também zeramos os impostos da cesta básica. Cortamos em trinta e cinco por cento o IPI de mais de quatro mil produtos. Você viu nos combustíveis? O ICMS estava lá em cima. Passamos para um teto de dezessete por cento"
00:00:38,"A gasolina está mais barata, o álcool também. O Brasil está dando certo. O Brasil está dando exemplo para o mundo. Emprego caiu PIB, subiu. Combustíveis. Exportações. Suprema. Impostos."
00:00:56,"Arrecadações sobre investimentos. Subir. Em plena pandemia o Brasil gerou quatro milhões de novos empregos. Anota aí. Com Bolsonaro no próximo governo tem mais seis milhões de empregos chegando no Brasil."
00:01:13,"Quem aí sabe a diferença entre dá o peixe e ensinar a pescar, hein? Não sei, explica aí. Os mais de vinte milhões de brasileiros que recebem auxílio Brasil de no mínimo seiscentos reais, agora receberão mais duzentos reais se começarem a trabalhar. Vai ser oitocentos reais mais o salário do"
00:01:33,"Trabalho. Eita coisa boa. Quando o Bolsonaro dá os duzentos reais a mais ele incentiva o trabalho. Isso é o oposto do que o PT fazia. Porque para receber o antigo Bolsa Família as pessoas não podiam trabalhar. Lembra?"
00:01:50,"Muita gente deixou de de arrumar um emprego justamente pra não perder o bolso dela. Lula também impediu de gerar emprego no sertão nordestino."
00:01:59,"Essa transfusão do rio São Francisco e o PT passou dezesseis ano lá e não fizeram e agora que chegou concluiu essa obra pra Paraíba que é a coisa mais importante pro Nordeste é a água e ele levou. A chegada da água deixou a terra boa pra produzir alimento se gerar empregos."
00:02:28,"E é Bolsonaro na veia. Vinte e dois. É vinte e dois neles. É vinte e dois. Vinte e dois."