timecode,text
01:17:47,"O outro não, o outro visita tudo que é tipo de coisa, tal e não tem fé em nada, né? Então, é interessante como a gente tá despertando em todas as religiões, tem ateus, né? Que votam no Bolsonaro, porque eh pelos seus valores, pela forma de governar. Eu acho que até acima da fé, respeitar a liberdade religiosa, mais uma liberdade, né? Que precisa ser"
01:18:07,"Respeitada. É o que nós estamos podendo passar pras próximas gerações. Porque há anos que a gente não via"
01:18:15,"Uma eleição com tudo que tá acontecendo. Ele tá sendo um aprendizado enorme. Tem muito medo. E olha, pra nós, pra nós e pra nossas famílias. E pro mundo, nós estamos dando um exemplo para o mundo. E tem muita gente, como cristão, eu digo pra vocês assim,"
01:18:28,"Categoricamente tem muito cristão que ainda não se pronunciou por medo que acha que política e cristianismo não se misturam."
01:18:34,"Eu digo a vocês gente, a Bíblia não só diz que nós temos que orar pelas autoridades constituídas, mas a Bíblia diz inclusive que nós nós precisamos exercer, né? Os o nosso papel como cidadão, quando Jesus diz, dê a César o que é de César e a Deus o que é de Deus, a gente tem que eh eh viver, saber viver num regime onde existe autoridades e"
01:18:54,"claro o o cristão sempre tem que porque são os nossos valores. Eh e e pra quem fala ai mas o estado é laico. O estado é laico mas não é ateu. No preâmbulo da da constituição de oitenta e oito começa lá eh me ajuda aí. Pelo amor de Deus Tão assim, o Estado é laico sim, mas ele não é ateu, então não tem"
01:19:14,"nenhum você cristão se posicionar. Eu te encorajo minha irmã e meu irmão se posicione ainda dá tempo. uma semana mas que vale um um recado também, a gente entende as várias personalidades, a dificuldade de lidar com pressão, não é uma questão de coragem ou de medo, mas você não"
01:19:34,"se manifestar se não quiser, apenas vote corretamente, vá pelo lado certo, compare os dois projetos de país que nós já tivemos, nós já tivemos os dois que estão na disputa governando o país, em que país você quer viver nos próximos quatro anos ou até além disso, né? Num país que favore eh que"
01:19:54,"prega e e executa a censura que tem ligação com todo tipo de gente que você não quer que os seus filhos estejam ligados, que se vangloria de entrar em determinadas comunidades dominadas pelo tráfico, porque eu posso entrar sem colete a prova de balas, o que quer dizer isso? Então pense em"
01:20:14,"esses aspectos que foram colocados ao longo da campanha, que apareceram já nos governos passados e no atual governo, compare isso. Não pense nos candidatos, mas em que país você quer viver, criar seus filhos, ver seus netos nascerem e deixar pras próximas gerações. Praquelas que vão nascer quando a gente já não estiver mais aqui, porque tudo isso se constrói"
01:20:34,"do tempo. Então, não precisa ficar declarando voto se você se sentir pressionada por enfim, meio artístico, meio jornalístico, por quem quer que seja a vizinhança ou até um amigo muito próximo, todos nós temos amigos esquerdistas, precisamos respeitar, mas apenas vote certo. Olha só, hoje é dia do aviador"
01:20:53,"E a gente queria mandar um abraço aqui pra Tenente PM Natália Giovani que é piloto do Águia em São Paulo que sempre arrisca aí sua vida pra poder salvar as pessoas e queria mandar um abraço especial aqui pra minha prima Roberta Zamber que é copiloto da LATAM. Um beijo primo."
01:21:09,"Vão vão criar um próximo debate aqui, um próximo tema? Bora. Que que a gente pode jogar aqui? Uma das coisas que eu que eu gostaria de trazer, isso é"
01:21:17,"enfim, porque eu sempre abro caixinha de perguntas, eu sempre recebo as objeções que batem sempre nas mesmas histórias. Eu eu vou começar falando uma daí a gente vai rodando e cada uma eh eh se posiciona com relação a objeções. Com o presidente Bolsonaro. Muita gente me fala assim, eu não vou votar nele porque ele atrasou na compra de vacinas. Gente, eu vou resumir. Tem um site que se chama Verdades do Bolsonaro ponto com ponto BR"
01:21:37,"que cê pode entrar lá, vai tá tudo resumido, o desenho do desenho pra irmã entender. Sobre as vacinas não teve atraso, eh não foi eh eh essa questão de ai demorou não teve isso, tem toda uma história."
01:21:48,"que a empresa não se responsabilizava por efeitos colaterais. Agora eu te pergunto, você colocaria a sua canetada lá? Sem saber o que que ia acontecer com a população? Então, vamos prestar mais atenção, gente e ler as coisas das fontes certas, parar de ser manipulado pela mídia. E olhar pros fatos, né? Olhar para os fatos. O a primeira vacina no mundo foi dada em"
01:22:08,"de dois mil e vinte na Inglaterra que era fabricante de vacina. Em dezembro ainda alguns outros países também fabricantes de vacina ou países muito pequenos que precisavam de uma quantidade muito pequena de vacina começaram a vacinar seus seus sua população. os outros países do mundo começaram em"
01:22:28,"de janeiro em diante. O Brasil começou em janeiro, o Brasil tinha recebido a oferta lá em dois mil e vinte de negociar, mas sem previsão de entrega, algumas dezenas de milhares de vacinas, eu não lembro exatamente quanto, mas sei lá, cinquenta mil ou seis ou sessenta mil vacinas. O Brasil tem duzentos e dez milhões de habitantes, mais"
01:22:48,"comprou mais de quinhentos milhões. Então, não havia qualquer chance de compra de vacina antes do momento em que o Brasil começou a comprar, Carla, que coisa rápida, porque é uma que eu mesma comprovei nas ruas, outro dia eu falei com uma pessoa, morador de rua, que era HIV positivo, soro positivo. Ele disse, não, mas"
01:23:08,"É que rolou em vários grupos aqui do das pessoas que são soro positivo que o Bolsonaro vai cortar"
01:23:13,"Eh do SUS os remédios pra soro dispositivo. Mentira."
01:23:17,"mentira deslavada, tá? Então, se você tiver algum soro positivo na sua família, converse com ele, porque com certeza ele deve ter recebido essa falsa notícia. E só pra encerrar aqui a a minha parte que eu provoquei, aí depois as meninas vão fazer a provocação delas. Eh antes do Brasil vacinar, antes de qualquer país do mundo vacinar, nosso Presidente assinou, ele foi num convênio"
01:23:37,"assinou uma medida provisória, já pra pra negociar essa história de de fabricar aqui no Brasil AstraZeneca, através da Fiocruz, então ele se antecipou antes de qualquer país vacinar, não teve atraso, então dúvidas, verdades do Bolsonaro ponto com ponto BR, cê vai mandar pra todo mundo que cê conhece que tá em dúvida que tá em cima do muro. Não, e tem mais uma coisa que cê também me puxando pela pelo"
01:23:57,"Pelo pela memória. Em outubro de dois mil e vinte que não tinha nenhuma vacina no mundo ele já fez a medida provisória com crédito extra pra comprar as vacinas pra elas ficassem prontas. Então é tudo balela, tá? Tão tipo tão te promovendo que fake news."
01:24:11,"E aquelas pessoas que quiseram se vacinar puderam se vacinar. E eu queria pedir de novo pro pessoal da produção está me pedindo pra lembrar do site do Bolsonaro ponto com ponto BR, você que quer que pode ajudar no dia trinta é muito importante, a gente precisa de você no dia trinta."
01:24:26,"Mas você precisa se inscrever, fiscais do Bolsonaro ponto com ponto BR. São seiscentos e quarenta e cinco mil sessões no no Brasil e a gente gostaria muito que tivesse pelo menos um fiscal por sessão. Então, compartilha aí com seus colegas, com seus amigos, com seu grupo de zaps."
01:24:41,"da das tias e tios do Zaps, tá? Quebra aí uma narrativa, vai, uma objeção, por exemplo, saiu uma uma que que o o Guedes já tinha avisado que ia ia mexer na aposentadoria? Da área econômica tem muito está sempre fazendo. O Janones é um deputado federal que foi contratado pela campanha de Lula pra ser o coordenado"
01:25:01,"de mídias digitais da campanha petista e ele tá em modo turbo, ele diz declaradamente, estou mentindo, mas espalhe ou parece que não é verdade, mas espalhem antes que tirem do ar. E por incrível que pareça a campanha do presidente Bolsonaro, a equipe jurídica entra com pedido no TSE porque aí é fake news. É fake news, não é com pedido pra proíba"
01:25:21,"De me xingarem de tais nomes porque eu não quero ser associado a isso como fez a campanha de Lula. Eh proíbam"
01:25:28,"fake news tão dizendo que os aposentados vão ter aposentadoria cortada, que o auxílio Brasil vai acabar, um monte de mentiras através da da do das mídias sociais de André Janones que tem milhões de seguidores e pede compartilhamento e as pessoas compartilham. O TSE não está julgando esses pedidos do presidente Bolsonaro já faz quase"
01:25:48,"Duas semanas que essas medidas estão circulando e por incrível que pareça o TSE está julgando os pedidos da campanha petista e esses pedidos estão lá no fim da fila. Parados. Parados. Queria mandar um abraço pro Fábio Dub que é o autor."
01:26:02,"eh humorista, né? Inclusive da música Vota Vota que a gente gosta. Vários beijos. Quem é? Beijo Fábio. E foi disseminada pelo Neymar. Eh disseminada pelo Neymar música chiclete. Até perguntando se foi o Neymar que fez ontem eu assisti, eu assisti essa parte da aula. É aí o Serginho. Mas agora a pouco estava fazendo e eu não sabia fazer a dancinha. Eu"
01:26:22,"e confirma vinte e dois é Bolsonaro. Bolsonaro por quê? Esse aqui é o B, né? Então o nome dele é Bolsonaro. Ah, aqui é libra dele. que cada pessoa tem um sinal. O meu, por exemplo, é o cachinho e o do Bolsonaro é esse daqui. Então, é vota, vota aí e confirma. Vinte e dois é Bolsonaro. Ah, cê também"
01:26:42,"Pode fazer essa dancinha, hein? Vai lá, pega o áudio original. Faz a dancinha. Vamos infestar as redes sociais aí nos próximos dias. Com a questão da censura. Ai. Que a gente precisa denunciar. Está sendo implantada a pedido do PT, vamos sempre reforçar. E que vai piorar, gente. Se o PT voltar vai ser muito pior."
01:26:58,"E a gente vai receber a gente vai receber a vice-governadora"
01:27:02,"de Santa Catarina, a primeira mulher que foi vice-governadora de Santa Catarina, eh Daniela Reiner, que agora foi eleita como a Carol de Tony falou agora a pouco, foi eleita deputada federal, vai ser minha colega de bancada lá, tamo muito feliz, que é uma mulher forte, poderosa, vai entrar aqui rapidinho com a gente pra contar um pouco comé que tá essa, comé que tá essa força de"
01:27:22,"Tá rodando pra pedir voto pro presidente, é Dani? Oi, Carla. Oi, mulheres maravilhosas. Que alegria tá aqui com vocês essa manhã. antes de mais nada"
01:27:34,"Eu preciso me solidarizar com a Cris e com tantas outras pessoas que foram censuradas nesse período e parabenizar pela força, viu Cris? Pela tua nossa, é um exemplo pra todas nós, é a é a"
01:27:47,"É a certeza de que a verdade não para, independente de ciência a gente dá um jeito de levar a verdade até as pessoas e é essa a verdade que vai mudar o rumo do Brasil, eu não tenho a menor dúvida disso. Diz diz diz Dani."
01:28:06,"Tão me vendo, tão me vendo aqui. Não, tá. Tá. Eu tô no aeroporto. Tá. Perfeito. Agora voltou. Eu tô no aeroporto, tô chegando no aeroporto. Hoje a gente tá desde as seis da manhã no terminal urbano, aqui em Chapecó. Entregando esse folhetinho aqui que a gente fez, ó. Sensacional. Olha, que bacana. E aqui,"
01:28:25,"Ah ao Google dos feitos do presidente Bolsonaro. Legal. E Excelente. Que que a gente tem feito Carla? Quando a gente fala em sair da bolha"
01:28:37,"Eh a gente fez um analisou os dados aqui, onde é que teve mais votos não votantes, né? E aonde tem voto perdido, voto que a gente consegue converter."
01:28:49,"E vocês sabem que aqui no oeste de Santa Catarina tem, vocês só falam agora a pouco da regularização fundiária e a gente tem muitos assentamentos antigos aqui que hoje são agricultores, são empresários rurais e que não tinham título de posse. E essas pessoas ainda estavam perdidas e a gente foi até"
01:29:09,"Elas conversou, mostrou quem é que regularizou a situação deles, quem foi o presidente que realmente olhou pras necessidades que eles tinham e"
01:29:20,"Ver o problemas dele, o problema deles através da regularização fundiária, através da da entrega dos títulos de propriedade, né? E aí permitiu que eles contraíssem empréstimos, que eles vendessem o produto de forma regular, eh mudou a vida deles, trouxe a liberdade pra eles. E é isso que a gente tem feito."
01:29:37,"Tem vindo no terminal urbano termos ido nos bairros eh temos ido onde a fora da bolha realmente assim é é o dia inteiro de tênis, jeans e camiseta sem maquiagem, sem cabeleireiro, sem nada. E a a gente está correndo atrás realmente do voto que a gente precisa converter"
01:29:57,"Porque é o momento de dedicação total agora eh a gente tá cansado todas nós a Carla tá há quanto tempo sem dormir aí Carla? Vinte horas já? É não hoje desde ontem de manhã eu tô meio perdida de que dia? Domingo que dia? Domingo vinte e três já."
01:30:14,"É, a gente tá mais ou menos assim também onde estou cansados, né? Mas a gente tá convicto de que é o único caminho que a gente tem, que não é só uma eleição, a gente vai definir o futuro do nosso país."
01:30:26,"A gente tá numa situação assim de extrema fragilidade, de extrema dificuldade, é é emergencial a situação, né? Ou a gente consegue reeleger o presidente Bolsonaro e continuar"
01:30:41,"ahm ahm com a nossa liberdade, continuar com o Governo que tá dando certo, que sanou as dificuldades do nosso país, que botou a casa em ordem, mesmo com todas as dificuldades que que o presidente Bolsonaro passou durante esses três anos, quase quatro anos metralhado o tempo inteiro"
01:31:01,"Tendo impedimentos o tempo inteiro é pandemia, é tanta coisa que que que acabou, que praticamente inviabilizou o governo e ele ainda assim manteve a coragem dele, a postura dele, que é algo peculiar, que ninguém pode"
01:31:18,"O contrário disso, né? E e e é o primeiro país que está saindo da crise, é um país que enquanto a a gente, gente, a gente tem que pensar também que nós estamos com três guerras no mundo, né? Não é só na Rússia. E está inviabilizando muita coisa e ainda assim o nosso Brasil"
01:31:34,"Tá dando certo, continuamos alimentando o mundo, né? Na sequência também. Então, assim, é, é, é, é impressionante o que tá acontecendo, a transformação que o nosso país tá passando. A gente não pode deixar, a gente não pode deixar isso parar. Então, é, é, é isso aqui, ó. é o bem contra o"
01:31:54,"e a gente tem ido pra rua, tem buscado cada vez mais apoio pro presidente e virar voto. É isso que a gente tá fazendo. Muito obrigada, viu? Brigada. Deus te abençoe aí na sua empreitada. Fica com Deus e eu preciso falar só mais uma coisinha se vocês me permitir. Rapidinho, que tão pedindo pra gente vai rodar a mesa agora. É. Precisamos sair. Você sempre pergunta porque"
01:32:14,"Que eu apoio o presidente. E a coisa mais importante que eu apoio o presidente é porque eu sou mãe como a Bia falou e eu tenho um filho especial como vocês sabem. Meu filho tem vinte e um anos. Ou seja, há vinte e um anos eu acompanho as políticas públicas pras pessoas com deficiência. E nunca."
01:32:32,"Eu batalhei a igreja pra botar o meu filho numa escola regular. Ele foi a primeira criança com com com deficiência intelectual. É. A entrar numa escola particular aqui em Chapecó. E foi muito difícil de eu conseguir fazer a entender que ele precisava aprender, que ele não estava indo ali só pra socializar."
01:32:51,"E vocês podem imaginar o que uma mãe passa ao torno de em torno de vinte e um anos pro seu filho ser independente e feliz. gente, em vinte e um anos, nunca. Ninguém fez o que o presidente a gente tem que rodar a mesa."
01:33:07,"Obrigada Gente, ó, antes da gente se antes da gente se despedir,"
01:33:12,"Falar da nossa ação Luciana em BH. Eu falo por você, ó, terça-feira eu e Luciano Hang estaremos em Belo Horizonte, essa terça de meio dia às quatorze horas na Praça da Liberdade, um ato simbólico."
01:33:27,"Eh a favor da liberdade e contra a censura. Gente brigada eu amei dividir essa mesa com vocês. Eu também amei Bela. Censura não. A gente vai interpretando o rang e a gente vai receber também. Quem Paulinha que a gente vai receber agora?"
01:33:41,"Marco Antônio e Pietra? Quem que a gente vai receber agora? Pietra Bertolazzi vai trocar todas as quatro, vamos sair às quatro e vai entrar a Pietra e o Marco Antônio que eu acordei hoje às cinco horas da manhã, mas cê pelo menos eu não dormi também, tá? Eu só queria enquanto tocam os outros lê aqui o que que o Luciano Hang tá tentando dizer, censura não."
01:33:59,"Liberdade sim, censura não. a justiça é cega e a democracia é muda. A liberdade é mais importante do que a própria vida."
01:34:13,"censurado dias e eu vou dar uma pausa rapidamente pra lembrar que ele foi censurado por fazer parte de um grupo de WhatsApp onde empresários conversavam opiniões deles sobre política e ele sequer se pronunciou nesse grupo. Futuro ou destino você escolhe?"
01:34:33,"Que mais que temos aqui? Esquerda não, deu, esquerda não deu certo em nenhum lugar, é uma verdade absoluta Quem vota errado paga a conta."
01:34:48,"Mais de doze milhões de seguidores são os seguidores que ele tem e não está podendo conversar e quem e querem me calar. Prazer estar aqui com vocês gente. Bom domingo. Estamos na luta. Beijo Cris. Beijos."
01:35:07,"E aí, pessoal, tudo bem com vocês? Oi, oi, pessoal. Boa tarde. Bom dia. Ainda. Boa tarde, ainda não? Ainda, bom dia. E aí, Pietra? Tudo bem? Tudo bem, dormiu bem? Eu fui, me acordaram de madrugada aqui, mas foi legal, eu me diverti. a Isabele ligou pra mim."
01:35:25,"Mas ó, é uma honra tá aqui na super live, não tenho palavras pra agradecer o convite tô na presença de Pietra Bertolazzi, anti-feminista, comentarista da Jovem Pan, participa lá do Linha de Frente É uma honra tá participando desse momento com vocês."
01:35:43,"A gente trouxe algumas notícias, né, Pietra? Sim, eu também queria agradecer o convite, um prazer tá aqui com todo mundo e tô aqui com o Marco Antônio, nosso superman, advogado, Superman, comentarista da Jovem Pan, debatedor e aliás, será que ele parece mesmo o Superman? podem mandar perguntar. e então"
01:36:02,"eu eu queria começar eh partindo de uma premissa aí que a gente tem visto eh tudo bom Luciano? Comé que cê tá? Tudo bem? a gente vai dar algumas notícias aqui que eu acho que são relevantes, depois queria ouvir o Luciano, se ele conseguir"
01:36:22,"Isso que o Luciano tá fazendo, muita gente dá risada, mas é importante ressaltar que apesar de parecer engraçado é muito sério, é muito sério e muito triste inclusive, porque"
01:36:35,"De novo a gente fala, né? Em arbítrio, em desmandos, eh de autoridades que nunca poderiam fazer ou que tão fazendo hoje no Brasil. Eh é que nem Luciano, o sensor que tava circulando no programa Pânico recentemente, né? Pessoal olha praquilo e fica, né?"
01:36:54,"Exato, mas é é uma crítica, é uma sátira e muita gente achou que era verdade. Muita gente. Porque o pessoal tá tão preocupado com os abusos que acontecem. Não seria nenhum absurdo se fosse verdade, né?"
01:37:06,"Não me surpreenderia se fosse verdade e que passa uma noção de materialidade né? O que é um burocrata que está lá em Brasília o que a gente fala, o que a gente lê, o que a gente transmite, o que a gente quer manifestar, o que a gente quer expressar num programa de televisão."
01:37:23,"Então, a presença física dele lá é uma sátira muito interessante. Olha só quem tá aí, Constantino, Rodrigo Constantino, nosso grande amigo e colega da Jovem Pan, tudo bom, Consta? Grande Marco Antônio Costa, tudo bom, cara? Um prazer."
01:37:41,"Participar dessa brilhante iniciativa a qual eu já abro aqui elogiando todos os envolvidos. Que legal Constar e você tem acompanhado a desde o começo? Você viu que eh Viu que a gente"
01:37:57,"A gente teve aí um pico gigantesco de audiência, milhares de pessoas acompanhando a gente, inclusive de madrugada e queria saber de você, que que cê tá achando da temperatura nesse momento? e fazer uma provocação, né? Ouvi dizer por aí, inclusive eu tava lendo um Twitter do Paulo Figueiredo"
01:38:12,"O TSE deu a segunda facada no Bolsonaro recentemente? Foi perfeita É isso, né? Assim, a gente já virou e parece que sim, né? E o presidente for reeleito e o Brasil impedir esse destino trágico, né? De virar uma nova Argentina, Venezuela."
01:38:31,"A gente vai dever muito sim ao Alexandre de Moraes, eu acho que cabe até uma estátua de bronze o o nosso querido amigo Luciano Hang pode até mandar fazer aí, botar talvez ao lado da Estátua da Liberdade nas lojas Havan porque ele tá ajudando, né? A eleger, mas ele tá ajudando como, né?"
01:38:48,"Eh lembrando qual é a essência dessa turma, qual é o DNA deles? Eles são autoritários. Eles querem controle. Hoje o o Marco isso é muito importante pra gente eh eh comunicar aqui pra reflexão geral. Hoje eh eu vi aquela postagem do Alexandre de Moraes sobre"
01:39:06,"Eh uma parte lá do do código eleitoral que é inconstitucional, né? Diga-se de passagem e tudo que eu fiz foi responder assim, Lula é ladrão. E aí um monte de gente comentando, cara que coragem, parabéns e aí cê para pra pensar assim, gente, tem alguma coisa muito errada com o país, o Brasil tá doente."
01:39:24,"Quer dizer que você falar que a grama é verde, que o céu é azul e que o Lula é ladrão, porque ele é ladrão, isso virou alguma preocupação, algum motivo de você eh eh ficar receoso de retaliação, de ir preso."
01:39:37,"Isso é uma coisa insana, nós tamos vendo aí o o o Luciano eh sessenta dias, já passaram mais de sessenta dias de censura. Eu consigo ver as postagens dele porque eu tô aqui nos Estados Unidos."
01:39:49,"e os doze milhões de seguidores que ele tem estão usurpados do direito de saber o que ele pensa durante esse período importante da eleição. Nós temos revista Oeste censurada dias sem poder publicar um vídeo, por acaso, bem na semana mais importante, a última semana das antes das eleições."
01:40:08,"Então, é tudo tão escancarado, Gazeta do Povo, Jovem Pan, o negócio ficou tão escancarado que tá lembrando aos aqueles que queriam ficar numa zona de conforto ali do isentismo, estão lembrando do que tá em jogo."
01:40:22,"É é uma turma que não brinca em serviço, que quer censurar mesmo, quer controlar tudo e um presidente que pode ter os defeitos dele, o Governo, pode ter os seus defeitos, apesar do que eu enxergo muitas virtudes, né? Eh mas que luta pelas nossas liberdades."
01:40:37,"Então, é como diria aqui o americano, né? No num dá pra ter dúvida. Então, eu acho que já viramos, eu acho que esse"
01:40:45,"Eh essa postura, esse que eles estão nessa semana toda, dobrando a aposta, intensificando a censura, a perseguição. Já denota desespero, eu acho que eles entenderam que a coisa virou, né? E tão dando um tiro de bazuca no pé,"
01:41:00,"Eh é difícil a gente enxergar a profusão de crimes que tá sendo cometido por autoridades não eleitas inclusive né? Não exato pelo TSE que é o meu caso também né? Imagina o escritório do Zanin virou uma máquina de processar pessoas né? De calar pessoas dele por ter emitido, não foi nem opinião, foi por"
01:41:18,"Foi lá fazer comentários bobos, né? Ali na linha de frente na Jovem Pan e eu recebi um processo de quinze páginas da primeira vez. E tá rolando no TSE ainda que eu nunca tive envolvimento com eh partido político nenhum, nunca fui candidato a nada, né? Então eh não é nem comuns a Bárbara, né? Agora sabe onde eu acho que foi o ponto de inflexão? Aproveitando que o Luciano tá aí"
01:41:38,"Foi exatamente aquele caso dos oito empresários, ali foi, ali foi a coisa mais assustadora que aconteceu até então, porque nós tivemos um um primeiro ponto de inflexão lá atrás com quando o STF impediu o presidente Bolsonaro de indicar o diretor geral da Polícia Federal, prerrogativa dele."
01:41:56,"né? E e com pouca substância, com base numa eh eh denúncia do Moro que hoje tá do lado de cá, voltou pro lado certo e entendeu o que está em jogo, né? Eh mas eh ali foi já um abuso de poder eh muito assustador e alguns eh apoiadores do Presidente achavam que ele tinha que ter comprado a briga ali. Não, eu vou indicar"
01:42:16,"Ele achou que talvez não valesse a pena e entubou, né? Entubou, engoliu o sapo. Dali em diante eles só intensificaram o grau de abuso. Só que essa questão dos oito empresários, eu sou do grupo, Marcos."
01:42:31,"Eu era do o Luciano, ele tava mais calado nesse grupo do que ele tá hoje. Sim. Ele não participava do grupo há meses. E aí, de repente, um, um chega e recebe a visita da Polícia Federal por um joinha. um grupo privado"
01:42:47,"Então aquilo ali assustou, aquilo ali teve gente da imprensa"
01:42:50,"militante que virou e falou, caramba, não dá pra defender um troço desse. Mas me impressionou, viu? Cada vez mais chato pra, tá ficando cada vez mais difícil pra essa turma. Ah. Defender o indefensável. Agora, a me impressionou e aí eu vou querer ouvir também o Luciano Hang com relação a isso, vou vou autorizar aqui a retirada do do adesivo de censura por parte do Luciano."
