timecode,text
02:36:17,"hoje todas as pessoas que tinham direito a voz perderam a sua voz, mas o povo angustiado pro dia trinta chegar. Você caiu também? É. Acho que o Sila agora a gente tá ouvindo. estamos vendo. Censura."
02:36:37,"censura, censura. caiu Só que eu vou fazer o seguinte, ao invés de deixar a baixar por causa da censura, começa a compartilhar mais a pra ser uma censura inversa, entendeu? A partir de setenta, uma coisa assim. Então, por favor, vamos mandar mais. setenta e cinco. Vamos lá pessoal"
02:36:57,"Presidente tá querendo chegar aqui, precisamos chegar a um milhão de novos. E atenção, ó o casal maravilhoso aí. Eu ia, ia falar uma, eu ia falar uma coisa acerca do Van Hattem,"
02:37:05,"eh o porque o Van Hattem ele foi uma das pessoas que sempre se eh nunca se furtou de fazer críticas a ao Governo ao que ele eh ao que ele discordava do do atual governo mas ele sabe que nesse momento e eu admiro muito já falei isso pessoalmente né Marcelo? Quando a gente fez o podcast admiro muito espero"
02:37:25,"Eh até coisas muito maiores na tua vida política eh que eu já conversei contigo pessoalmente também eh e assim não nunca se furtou de criticar e agora nesse momento tão decisivo ele sabe como é importante esse apoio ao Bolsonaro. Coisas como eu vi ontem aqui que eu fiquei muito feliz de ver o"
02:37:44,"O que era do do MBL tava aqui o Olha. O o Fernando o Holiday aqui diferente. Diferente do próprio MBL, por exemplo, que que eu nem sei se a gente pode falar dele, mas assim, que eu não consigo compreender como no momento tão decisivo e importante pra nação brasileira,"
02:38:03,"uma uma um pessoal como eles que tão a frente e são referência pra tantas pessoas não se posicionarem e e quererem taxar Lula e Bolsonaro como duas opções exatamente iguais, isso é um absurdo, é inacreditável. Mas eu acho que eles deixaram, até a gente pode eh fazer mais uma rodada pra ouvir o Malafaia"
02:38:23,"O o também o Marcel Van Hattem sobre isso. Eu acho que eles perderam essa referência que existia antes. Perderam a credibilidade."
02:38:32,"Que nem muito político macaco velho. Sim. Perdeu a bússola da política também. Eu eu vi uma galera desorientada nessas eleições. Exatamente porque eles estavam criando essa espécie de terceira via que nunca existiu. Bolsonaro era a terceira via."
02:38:47,"Do Teatro das Tesouras, ele quebrou o teatro no meio e ficou um monte de gente perdida no meio do caminho. Só pra dar dois exemplos bizarros, Doria,"
02:38:56,"Sim. MBL e a galera que traiu o o Bolsonaro de maneira expressiva. Amoêdo, Joice. Nossa. Joice. É uma galera acho que eles caíram de novo? E e ó e eu vou Há uma voz."
02:39:13,"Eh gente, a gente vai agradecer a presença de vocês. A gente precisa rodar, porque tem muita gente muito legal pra participar e e é isso, brigada. Nós que nós que agradecemos o convite, agradecemos eles, muito obrigado, queria mandar um abraço pro pessoal lá do canal Imports que tá trabalhando direto lá pra tentar fugir dessa censura. Um abraço pra todo mundo lá pro nosso pessoal"
02:39:32,"E Com certeza, se Deus quiser continuaremos. Eu sou fã desse desse canal hipócrita. É maravilhoso. É maravilhoso. Maravilhoso. Quem não viu ainda."
02:39:41,"Precisa procurar. Até o próximo episódio que a gente vai falar. Próximo Superman. Aquele aquele vídeo nunca foi gravado, a gente vai gravar aquele sobre o feminismo. Ele vai fazer o Superman no nosso vídeo também. Exatamente. Muito bom, gente. Compartilha a é muito importante que a gente compartilhe a é uma muito importante. Então, não deixe de compartilhar. Tem muita gente aí que só"
02:40:01,"esperando pra hora que alguém entrar. O Gustavo Lima, gente, desde já nós temos que tá compartilhando então é muito importante. E peguem o link novo, porque a cada dez horas tem que trocar o link. Então, esse é o terceiro link já, tá? Que a gente vai lá. Vamos lá, a gente. Terceiro quarto. Falou, pessoal, falou, abraço, Zé Galinha, Zé Galinha, abração. Ele pediu pra eu mandar um abraço pra ele ao vivo. Valeu. Eu vou agradecer ao Van Hattem também."
02:40:21,"Eh brigada de coração Barraca, também sou muito fã aí do do teu trabalho de do teu posicionamento e queria agradecer você também. A gente precisa também dar uma rodada aqui na mesa e e quem que a gente vai chamar agora? Mas dá pra. Mas é não, mas mas fecha antes da gente rodar."
02:40:40,"Tá, a senhora não queria comentar sobre essa essa final aí do Paulo Hipócrita, a gente fez críticas e muitas vezes criticou de uma forma construtiva o governo e apoiou"
02:40:53,"Com menos você sabe ver o governo andando mais do que a própria base do governo, a reforma da previdência, reforma administrativa, porque a gente tem um projeto de país, a gente quer um Brasil melhor e tem muita gente que tá na política, infelizmente, por vaidade, tá aí pra"
02:41:05,"Cumprir desejos de enfim ambições pessoais. Eu acho que esse momento é um momento de unir o país contra aqueles que já destruíram"
02:41:14,"muitas das nossas instituições das últimas décadas já tiveram no poder e é por isso disposição aí da campanha ontem estive em vários municípios agradecendo os votos que eu fiz a Deputado Federal e levando a todos principalmente Fica o recado, principalmente pra quem anulou seu voto no primeiro turno, votou em branco ou como eu votou em outros candidatos, votei no Felipe"
02:41:34,"Lembrar que agora tem só duas opções, né? Ou você volta pro passado que é PM do PT, do Lula e da Dilma, que a gente não quer mais, ou a gente segue em frente pra isso, é Bolsonaro vinte e dois agora no dia trinta. Então, é esse o recado final, queria deixar muito obrigado aí pela oportunidade e que agradece."
02:41:53,"E vamos em frente, brigadão. Abraço Marcel. Abraço. Posso dar aqui meus agradecimentos também. Silas já pode ir embora, produção, você fica Você fica Priscila. Brigada Marcelo, brigada. Você fica Silas."
02:42:08,"Eh de aprender você mais um pouco aqui. E aí eu queria fazer uma pergunta pro Luciano"
02:42:14,"sobre a questão do empresariado, né? Sobre os empresários estarem começando a sair dos armários políticos, né? E se assumindo bolsonaristas ou da direita. Existe algum movimento, algum grupo pra incentivar? Porque ainda tem alguns que tem esse esse receio, né? Dependendo da área principalmente. Olha, muito boa a pergunta, Petra, ah eu notei que dois mil e dezoito pra cá os empresários começaram a sair"
02:42:34,"De cima do muro e nessas eleições agora muitos empresários realmente tão se manifestando eh isso é muito importante. Eu tenho certeza que noventa e cinco por cento dos empresários brasileiros"
02:42:46,"Estão do lado do presidente Bolsonaro. Com certeza. Diferentemente daqueles empresários que assinaram aquela cartinha de de de da democracia lá de trás."
02:42:56,"que faz parte dos oligarcas, aqueles grandes empresários que querem a volta do PT para o poder pra eles continuar tendo aquela ligação que eles tinham lá trás, né? Então são os empreiteiros, aquele pessoal que quer voltar a cena do crime, né? E isso o brasileiro não quer mais. Aquele empresário pequeno"
02:43:16,"Médio"
02:43:17,"o grande empresário tá tendo a coragem de se manifestar porque tenho certeza que não vão mais investir no Brasil se o PT votar. Quero dizer pra você que tá me ouvindo eh eu tenho muitos amigos e as pessoas diz o seguinte, eu não vou mais investir no Brasil se o PT voltar. Isso"
02:43:36,"é porque sabe o que tá acontecendo na Argentina, sabe o que tá acontecendo eh na Venezuela, sabe o que tá acontecendo na Colômbia agora, onde o iFood sai nove mil empregos eh agora, sendo que cinco mil são venezuelanos. Eu quero mostrar pra você uma quem vota errado paga a conta"
02:43:55,"Quem vota errado pa pa conta. Eu eu tenho quatrocentos empregados eh venezuelanos."
02:44:02,"E quando eu fui numa das lojas nossas"
02:44:04,"eh e as pessoas vem chorando contando a a tragédia que é a família deles que de repente os pais moram ainda na Venezuela e eles tiveram que sair do país pra conseguir dinheiro e mandar pros pais. E eu pergunto pra eles, mas vocês votaram errado, vocês votaram na época do Hugo Chávez e uma dessas dessas minhas colabora"
02:44:24,"De vinte e dois anos falou assim pra mim, Luciano eh meus pais votaram errado e eu estou pagando a conta. Eu estou aqui trabalhando no Brasil"
02:44:35,"Pra mandar dinheiro pra minha família, que passa fome na Venezuela. Então, as pessoas que me veem pensando que não vai acontecer no Brasil, porque o Brasil é muito grande. Esqueça."
02:44:48,"eh eles entrando no poder, isso aqui vira um caos, o dólar sobe, a inflação sobe, o desemprego chega, as empresas vão embora. Sabia. E nós vamos sim virar uma Venezuela tamanho família. É. Coloque isso na cabeça de vocês. Ahm Luciano, eu queria complementar"
02:45:08,"trazendo uma notícia recente do de algo que tá acontecendo agora. existe uma operação da Polícia Federal do Roberto Jefferson. Agora, acontecendo agora. Caramba. A gente sabe, a gente sabe exatamente o que aconteceu faz pouco tempo. No Twitter, ele se manifestando nas redes sociais."
02:45:27,"A gente sabe como ele se manifestou e isso oi Silas, eu eu queria só enaltecer como isso é problemático e como isso A gente tá aqui defendendo a liberdade, a gente tá tentando trazer um clima. Oi? Tá bom? Então tá. Pediram pra eu falar"
02:45:47,"Eh Silas, queria te ouvir. Pode. Olha só, deixa eu dizer uma coisa, eu discordo da maneira que Roberto Jefferson fala. Mas o que é liberdade de expressão? Liberdade de expressão é você emitir sua opinião"
02:46:06,"Por mais esdrúxula que ela seja. Se você cometer injúria, calúnia e difamação, tá previsto na lei. Sim, exato. Pra responder. Agora, o que não pode minha gente, o que não pode é o senhor Alexandre de Moraes."
02:46:22,"Ministros do STF do TSE usarem a foga e o poder da caneta pra impor o silêncio, discordar e alguém que se sentir caluniado."
02:46:36,"Difamados vai pra justiça. Procura, né? Se sentiu injuriado, caluniado. Exato. Difamadas pelas palavras de Roberto e Gerbas."
02:46:48,"Então, que ela entre na justiça na primeira instância. Exato. Isso é estado democrático de direito. Perfeito. Que liberdade de expressão é pra todo mundo falar uma mesma coisa é ditadura da opinião. O que que é esquerda gente? Isso aí é o jogo é grande."
02:47:08,"Isto é o batismo cultural, Se você não falar segundo politicamente correto, você é banido. Sim. Esse é o jogo, é um absurdo no estado democrático de direitos."
02:47:26,"Tem uma emissora de televisão censurada. ditadura, é um absurdo Polícia Federal na casa de Roberto Jefferson, porque eles falam agora não é absurdo o que a ministra falou"
02:47:45,"Cara de pau, maior cara lavada. Olha, excepcionalismo, mas eu vou rasgar Exato. E Silas, eu queria dar uma pivotada aqui, vamos pivotar, porque todo mundo partilha dessa indignação, eu tenho certeza."
02:48:02,"E eu acho que no espírito desses últimos sete dias aí de campanha que a gente vai ter eh enaltecer as coisas boas do Brasil que foram, né? Consequência de uma gestão eficiente."
02:48:15,"Do Governo Federal, ministérios técnicos, da equipe técnica que dá esse subsídio pro Bolsonaro e que tem contribuído pro Brasil ser um destaque no mundo inteiro. Poxa. Porque se a gente comparar o Brasil com os países da América Latina, inclusive Estados Unidos e Europa,"
02:48:33,"A gente tem o desempenho completamente acima da média, no que se refere a inflação, no que se refere a queda do desemprego, né? A gente tá falando aí de uma população ativa de mais de cem milhões de pessoas trabalho"
02:48:47,"A cada cinco pratos de comida no mundo, um é colocado pelo Brasil. Isso é fenomenal. As estatais que deram prejuízos de bilhões"
02:49:00,"Deram lucro em três anos e meio de governo Bolsonaro e setenta e oito bi, que que é isso, minha gente? Quarenta e um anos. E vai fazer um grande governo. Pela primeira vez em quarenta e um anos o Brasil vai ultrapassar o crescimento da China."
02:49:17,"Só em mil novecentos e oitenta e um o Brasil esteve na frente da China, depois sempre perdemos agora este ano."
02:49:25,"A China vai crescer dois ponto sete, dois ponto oito, o Brasil pode crescer acima de três por cento. A inflação caindo. Nós temos nos próximos anos a chance de mudar de patamar como o país. Sair do país do futuro pra ser o país do presente."
02:49:43,"Eu e o Silas que são um pouco mais velho aí, né? Talvez Silas podemos ver o Brasil que nós queremos acontecer. Eu tô com sessenta anos de idade, eu quero ver esse Brasil ainda, esse país. Sim. Esse país pujante. Eh quando um brasileiro procurar trabalho"
02:50:01,"ele vai pra Santa Catarina ou ele vai pro Nordeste? Ele vai pra Santa Catarina. Por que que Santa Catarina é o sucesso que é? Porque nunca teve o governo de esquerda, nunca teve um PDT, nunca teve um PCdoB, um PSOL, um PT e também não vai ter. Não vai"
02:50:21,"porque o catarinense ele acredita no trabalho, na do liberalismo econômico, de que as empresas possam gerar os empregos que a população quer. Ninguém quer viver de bolsa de alguma coisa. Todo mundo quer viver com o suor do seu rosto."
02:50:41,"Santa Catarina, vê porque que Santa Catarina, aliás, né? Como empresário, eu vou procurar copiar uma empresa que deu certo ou vou copiar uma empresa falida, não é isso? Vou copiar uma empresa que dá certo. Então, copie em Santa Catarina, eu vejo o Rio Grande do Sul que eu estou lá agora"
02:51:01,"Com quinze loja, fui um dos últimos estados que eu coloquei em loja, porque lá"
02:51:07,"eh a esquerda tomou conta do Estado, vocês são vítimas da esquerda eh e tem que tomar cuidado agora, né? Temos lá o presidente Bolsonaro pra ser bem votado no Rio Grande do Sul, tem o nosso ministro Onyx pra ser votado no Rio Grande do Sul pra que o Rio Grande do Sul volte a ser"
02:51:27,"Aquilo que foi há quarenta anos atrás. Então é o seguinte pessoal, quer mudar de vida, quer ter qualidade de vida? Vote nos candidatos da direita, esse sabe."
02:51:38,"Como fazer, como montar equipe. E Luciana, sobre qualidade de vida, a gente se atenta muito às questões econômicas, mas principalmente aqui em São Paulo, a gente fica muito preocupado com a violência, né? E os índices pós eh Bolsonaro foram"
02:51:51,"Fantásticos em relação a violência, né? A gente teve noventa e oito por cento de diminuição de invasões de terras, né? Do MS do MST. A gente teve uma apreensão de de drogas que aumentou cinquenta por cento. Ahm as taxas de homicídio caíram drasticamente também. A gente teve um um pico na na Dilma se não me engano de sessenta e sete mil homicídios por ano. Hoje a gente caiu pra quarenta"
02:52:11,"Quarenta e dois mil então é assalto índice de assalto em bancos no no interior também caiu mais de cinquenta por cento. Então isso isso também é uma coisa muito cara pra gente, né? Que quer defender nossos filhos, a nossa família. Mas sabe o que que é isso? É emprego."
02:52:26,"A minha cidade Brusque, Santa Catarina, que tem pleno emprego, aliás, eu estou colocando"
02:52:31,"Carros nas ruas para arranjar trinta colaboradores não tem eh bateu o coração a gente contrata lá em Santa Catarina. Eu também a gente vai ter que rodar aqui a mesa de novo, é a dança das cadeiras. Queria agradecer o pastor Silas Malafaia, brigado Silas. Silas, prazer tá aqui. Pra você. Um ótimo domingo. Eu quero"
02:52:49,"Eu quero agradecer a vocês e quero dizer uma coisa aqui que vai da minha fé. Por favor, permitam-me. A injustiça não vai prevalecer contra a justiça mentira não vai prevalecer contra a verdade porque a justiça e a verdade"
02:53:07,"são base do caráter de Deus. E a última coisa, o povo cristão desse país que a maioria ser cristão não é uma religião, é um estilo de vida. Ser cristão é na escola, no trabalho, nas relações sociais e na hora de votar. Eu não acredito"
02:53:27,"Que verdadeiros cristãos que a maioria do povo brasileiro vai votar em alguém que defende aborto, que diz que a família é coisa ultrapassada, cujo partido defende ideologia de gênero, eu tenho certeza que o povo cristão que a maioria nesse país na hora de apertar a tecla"
02:53:46,"Vai lembrar que ele é cristão também na hora de votar. Deus abençoe vocês, Deus abençoe toda essa turma, Deus abençoe o Brasil e Bolsonaro"
02:53:56,"dia trinta, nós vamos vencer essas eleições em nome de Jesus. Um beijão. É isso aí Silas. Um abraço, um abraço. Brigado. Brigado. Queria agradecer Luciano Hang também, brigado Pietra, um beijo pra vocês. Agora vocês tão. Beijo gente. Thiago Asmara ali. Beijo pra todo mundo. Cês pessoal de peso aqui chegando. lá."
02:54:15,"vai falando, vai falando. Aí meu amigo censura não. Censura não. Não a censura. Censura não. Censura não."
02:54:32,"Não. Censura não. Eu voto pela liberdade. Eu voto pela liberdade do Brasil. Pela liberdade. A gente vota pela liberdade. Eu voto pela liberdade. Eu voto pela liberdade. Eu voto pela liberdade. Eu voto vinte e dois. Vinte e dois. Eu voto vinte e dois. Eu voto vinte e dois. Eu voto vinte e dois. eu vou"
02:54:50,"Bom, assumimos aqui o comando, né? Que honra em primeiro lugar tá aqui nessa mega live do presidente Bolsonaro. Tava também aqui com a minha noiva Lívia que assume ser Bolsonaro também, também trabalha na Jovem Pan, também tem coragem pra se impor e vai tá aqui com a gente."
02:55:09,"Ministro Juca, né? Assim que prefere ser chamado Joaquim Leite, ministro do meio ambiente aqui no nosso bloco de esporte, porque é faixa preta de jiu-jitsu, casca grossa. Agora, primeiro, né? Pra gente começar"
02:55:24,"Eu queria deixar claro o porquê de eu estar aqui, o porquê de eu ter sido convidado. Primeiro, porque eu assumo mesmo e tá aqui, ó, a camisa autografada pelo homem, pelo Bolsonaro admirar, né? A posição dele, por admirar a transparência"
02:55:40,"É um cara honesto, né? A gente pode falar em honestidade, falando de Bolsonaro e pra falar um pouquinho da entrevista que eu fiz com ele lá no canal pilhado, né? A gente vai chamar aqui pra participar José Aldo, tem também Vitor Belfort, muitos atletas que apoiam o presidente."
02:55:59,"E a Lívia tava comigo lá também sobre a simplicidade desse cara, falar sobre o Bolsonaro hoje é falar sobre um presidente que todos os funcionários, né? Que eu conheci da presidência deixaram claro, é o presidente mais simples que passou por aqui."
02:56:17,"Ele almoça na cozinha, ele tem relação com todos os funcionários, trata todo mundo bem. Então, eu acho que é importante a galera saber quem é o Jair Bolsonaro, porque a experiência que a gente teve, né, Lívia? Poucos vão ter. Poucos vão saber da simplicidade que esse cara tem. É verdade, eu até comentei com o Tiago."
02:56:36,"Boa tarde, boa tarde pra todo mundo, boa tarde ministro, aqui também tá aqui com a gente, é uma honra fazer parte aqui dessa bancada, a pouco o Silas Malafaia falando aqui, eu quero até deixar meu meu abraço aqui pra ele, eu como cristã também, neto do meu vô Olívio que era um fã"
02:56:50,"do Silas então eu queria deixar eh registrado essa honra aqui que é tá falando aqui pra todo mundo logo após o Silas. Mas eu quero falar sobre isso porque eu acho que todo brasileiro deveria ter a oportunidade conhecer pessoalmente o Bolsonaro. tive essa honra e eu falo"
02:57:09,"Depois disso, eu não virei fã, virei, sei lá, seguidora fiel até pro resto da vida. É impressionante assim, a simplicidade dele eh ele traz esse lado humano que eu acho que as pessoas esquecem, ele é uma pessoa, né?"
02:57:22,"Ele é o nosso presidente, mas ele é isso, ele é humano, ele é família, ele é aqui ó, ele pegou a gordura da carne, do Thiago ali do prato, foi incrível assim, a gente almoçou com ele lá na cozinha dos funcionários assim, essa simplicidade chamou minha atenção e agora ele ganhou uma fã pro resto da vida. É isso, né ministro? E você?"
02:57:38,"Tenho a honra de fazer parte desse time dos sonhos do Bolsonaro. Ele chama de time dos sonhos e ele não chama à toa. Porque ele não escolhe por amizade, ele não escolhe por troca de favor. Ele escolhe porque tem competência. E você agora assume esse ministério, né? Do meio ambiente"
02:57:56,"E é legal a gente falar também, a gente já já vai falar com atletas. Eh agora pra esses caras é fácil"
02:58:02,"assumir, né? Porque mesmo que seja atacado é o Josealdo, é o Vitor Belfort, pra mim que fica mais complicado, mas agora ministro, qual é o sentimento de fazer parte desse time e o que falar do meio ambiente pra galera que tá aqui com a gente na nossa na mega do presidente Bolsonaro? Thiago, brigado, é uma honra tá aqui"
02:58:21,"É claro que é uma honra tá aqui e é uma honra ser ministro desse time dos sonhos, um time de sonhos do presidente Jair Bolsonaro que tem Paulo Guedes, que tem satisda, que tem Carlos França, que tem Marcelo Sampaio nos ministérios, todos os ministros supercompetentes"
02:58:38,"Além disso, nós temos Caio Andrade na Petrobras, Daniela Marques, na Caixa. Fausto no Banco do Brasil e Montezano no BNDES. Esse é um time competente, é um time que entrega, que entrega resultados pra sociedade. o presidente Bolsonaro"
02:58:55,"ele é um criador de líderes, ele criou um líder aqui em São Paulo, Ricardo Salles, super bem votado. Tarcísio? Tarcísio? Tereza Cristina, Marcos Montes, Damares? Damares, Jorge Safe que tava aqui agora, esse é um democrata real. Ele é luz, né? Nada. É quem traz ah novos líderes pra"
02:59:14,"tocar esse país e eu acho que esse é um grande exemplo. O que nós fizemos no meio ambiente e começou em dois mil e dezenove já com Ricardo Salles que eu tive a oportunidade de trabalhar tive a oportunidade de ser convidado por ele, pelo presidente e pelo pela equipe pra trabalhar agora como ministro do meio ambiente, que que nós fizemos? Saímos duma"
02:59:34,"Simplório é a agenda de simplesmente multar, reduzir, culpar o setor privado pra junto com o setor privado criar uma nova economia verde. Uma nova economia verde que passa pelo marco do saneamento que o governo o governo federal aprovou que vai resolver o problema de tratamento de esgoto."
02:59:51,"De cem milhões de pessoas que não tem acesso a esgoto. O marco dos resíduos sólidos já fechamos oitocentos lixões a céu aberto, isso é superimportante e a gente tem que eliminar os lixões a céu aberto e começar uma reciclagem. Uma reciclagem que o Brasil bate recordes, latinhas de alumínio quase cem por cento reciclada."
03:00:09,"Outro tema importante defensivos agrícolas o Brasil é o número um do mundo no retorno de embalagem defensivos. Esse é um é um é um tema bastante importante. Levar a reciclagem e fazer da reciclagem um pouco falado também né? Muito pouco falado. O governo federal também claro bateu recorde de energia eólica e solar."
03:00:27,"Nós instalamos praticamente uma Itaipu e meio em quatro anos de eólica e solar e uma energia mais barata. E ministra uma coisa que eu acho importante a gente falar é que muitas dessas realizações elas não tem destaque na mídia, né? Porque a gente vê hoje uma mídia em sua grande parte"
03:00:46,"Voltada prum palanque da esquerda, é um palanque da esquerda, é uma assessoria de imprensa da esquerda. Então, as grandes conquistas que a gente vê"
03:00:53,"No governo Bolsonaro, raramente a gente vê em grande parte dessa mídia que hoje eu chamo de corja, eu chamo de uma corja, eu chamo de algo sujo, de algo feio e de algo que me envergonha a ser jornalista no Brasil."
03:01:07,"Tá. Eu acho que esse tudo que a gente fez pelo meio ambiente a gente continua fazendo esse trabalho conjunto com o ministro Sachsida que a gente que o Ministério da da Minas e Energia conseguiu incentivar incentivar a energia solar e na energia eólica. Esse é um grande feito"
03:01:23,"São aí doze gigawatts de energia solar, energia mais barata, seis gigawatts de energia eólica."
03:01:30,"Energia mais barata, duas Itaipus praticamente instaladas e você não vê em lugar algum. Além disso, nós criamos o mercado de carbono de crédito de carbono, pouca gente entende desse tema, mas foi o Governo Federal que criou o mercado global e o mercado nacional de Creu de Carbono."
03:01:45,"Nós também temos uma uma política de renovação de frota, a frota brasileira envelhece e o Governo Federal vai incentivar a troca de um veículo, de um caminhão, de um barco, de um trator, de um veículo leve prum veículo mais novo."
03:02:00,"Tem várias ações do Governo Federal, é como você comentou, nós tamo aqui exatamente pra mostrar um pouquinho o que que a gente faz lá e nós temos que mostrar ao público que nós somos responsáveis por um meio ambiente, nós protegemos o meio ambiente e atuamos de uma forma racional. Esse é o modelo"
03:02:15,"Do Governo Federal e que muitas vezes as pessoas elas não tem acesso a isso e isso que é importante nessa por isso que a gente pede pra todo mundo compartilhar o link da pra todo mundo deixar o like na"
03:02:27,"Porque você compartilhando essas informações que muitas vezes a gente não vê nessa mídia tradicional que eu chamo de suja e sua grande parte, deixando bem claro, a gente vai poder mostrar aqui e sobre essa situação a gente já já vai chamar aí"
